{
  "name": "1-2 대숲 산길",
  "w": 210, "h": 44,
  "theme": "bamboo",
  "ambient": [92, 112, 110],
  "ceilY": 320,
  "rects": [
    [0, 0, 1, 44, "M"],
    [209, 0, 1, 44, "M"],

    [1, 40, 40, 4, "#"],
    [14, 34, 5, 1, "="],
    [20, 28, 4, 1, "="],
    [26, 14, 1, 26, "Z"],
    [32, 10, 1, 30, "Z"],
    [28, 21, 3, 1, "="],
    [40, 12, 8, 32, "#"],

    [48, 12, 13, 3, "#"],
    [61, 40, 12, 4, "#"],
    [61, 39, 12, 1, "^"],
    [64, 6, 1, 33, "Z"],
    [69, 8, 1, 31, "Z"],
    [73, 14, 16, 3, "#"],
    [76, 9, 4, 1, "="],
    [89, 40, 16, 4, "#"],
    [89, 39, 16, 1, "^"],
    [97, 10, 1, 29, "Z"],
    [105, 12, 18, 3, "#"],

    [123, 30, 43, 14, "#"],
    [136, 24, 5, 1, "="],
    [142, 14, 1, 16, "Z"],
    [148, 28, 4, 2, "B"],

    [166, 36, 40, 8, "#"],
    [166, 18, 40, 2, "#"],
    [206, 0, 3, 44, "M"]
  ],
  "gates": [[165, 20, 1, 16]],
  "points": [
    [4, 39, "player"],
    [4, 39, "check"],
    [10, 39, "grunt"],
    [30, 20, "lamp"],
    [55, 11, "grunt"],
    [78, 8, "gunner"],
    [83, 13, "grunt"],
    [93, 8, "ring"],
    [100, 6, "ring"],
    [107, 11, "check"],
    [112, 11, "grunt"],
    [119, 11, "gunner"],
    [114, 9, "lamp"],
    [138, 23, "gunner"],
    [145, 29, "grunt"],
    [154, 29, "grunt"],
    [160, 29, "check"],
    [158, 26, "lamp"],
    [176, 22, "ring"],
    [195, 22, "ring"],
    [196, 35, "boss", { "arena": [166, 206], "trigger": 170 }],
    [172, 33, "lamp"],
    [200, 33, "lamp"]
  ]
}
